"id","name","description","img","gemstone","location_of_origin","origin","treatments","cut_type","weight","dimensions","cut_by"
217,"Andalusite","Andalusite is named after the Spanish province Andalusia where transparent gem-quality crystals were first found. 

Faceted andalusite stones give a play of red, green, and yellow colours because of strong pleochroism.","https://www.gemdat.org/gphotos/0718418001344600949.jpg","Andalusite","Brazil","Natural","None reported","Round Brilliant","1.25 cts.","6.7mm x 6.7mm x ?","commercially cut"
220,"Andesine","Andesine feldspar is composed of 50-70% albite and 30-50% anorthite.

Andesine was first described in 1841 for an occurrence in the Marmato mine, Colombia. It is named after the Andes mountains of South America.

Andesine is found in a range of colours, from red, honey-red to orange, yellow, champagne and green.","https://www.gemdat.org/gphotos/0585192001343678222.jpg","Andesine","China","Natural","None reported","Trillion","2.05 cts.","N/A","N/A"
223,"Andradite","Andradite is a species of the garnet group. It was named after the Brazilian mineralogist José Bonifácio de Andrade e Silva (1763–1838).","https://www.gemdat.org/gphotos/0323026001343745113.jpg","Demantoid","Russia","Natural","None reported","Oval","2.09 cts.","N/A","N/A"
2254,"Kornerupine","Kornerupine was named after a Danish geologist and explorer A. N. Kornerup. 

The colour can vary from brown, green to shades of yellow, the material is strongly pleochroic and frequently asteriated (from Burma and Taita Hills, Kenya). Cat's eye effect is due to inclusions of rutile and graphite.

Kornerupine can be faceted or cut into cabochons. Cut stones are up to 20 carats (usually to 3 carats).","https://www.gemdat.org/gphotos/0760136001342799806.jpg","Kornerupine","India","Natural","None reported","Cabochon","1.20 cts.","N/A","N/A"
2289,"Kunzite","Kunzite is the pink to light purple gem variety of the mineral Spodumene.

Kunzite is named after the US mineralogist G.F.Kunz, who first described this gem in 1902.","https://www.gemdat.org/gphotos/0476206001345318516.jpg","Kunzite","Brazil","Natural","None reported","Oval","260.61 cts.","N/A","N/A"
2303,"Kyanite (Cyprine)","Kyanite is named after Greek word for ""blue"", because of its colour. Some fine specimens have sapphire-blue colour with violet pleochroism. 

Kyanite has a wide variations of hardness in the same crystal depending on direction (across or along axes). It complicates the cutting of this material. 

Cut stones reach 10 - 15 carats. Varieties with alexandrite effect and cat's eye are known.","https://www.gemdat.org/gphotos/0604818001343680234.jpg","Kyanite","Nepal","Natural","None reported","Oval","3.03 cts.","N/A","N/A"
2308,"Labradorite","A type of feldspar consisting of between 30-50% Albite and 50-70% Anorthite.

Labradorite was named after peninsula of Labrador in Canada, where it was first found. 

It shows labradorescence - a shiller effect in lustrous metallic tints, often blue and green, and sometimes the complete spectrum. This effect is caused by interference of light from lattice distortions resulting from alternating microscopic exsolution lamellae of high- and low-calcium plagioclase phases.","https://www.gemdat.org/gphotos/0485599001351029819.jpg","Labradorite","Madagascar","Natural","None reported","Heart Cabochon","9.6 cts.","17.27mm x 14.62mm x 5.72mm","N/A"
233,"Anglesite","Anglesite is named after the type locality on Anglesey, an island off the north coast of Wales.

Anglesite forms transparent colourless crystals, often with yellow, green or blue shades. Anglesite is cut into attractive faceted stones, but it is brittle and sensitive to heat. 


Fine crystals are found at various places in the USA, in the Leadhills district, Scotland and the best cuttable material comes from the Touissit mine, Oujda, Morocco.","https://www.gemdat.org/gphotos/0771474001344633654.jpg","Anglesite","Tsumeb, Oshikoto Region, Namibia","Natural","Bleaching","Emerald","9.13 cts.","10.1mm x 8.0mm x ?","Dee Parsons"
2330,"Lapis lazuli","Lapis Lazuli (Arabic and Latin - blue stone) can be described as an impure variety of the mineral Lazurite, however more accurately it is a type of rock containing primarily Lazurite (25-40%), Calcite and Pyrite (also augite, diopside, enstatite, mica, hornblende, sodalite, haüyne). 

It has a very distinctive blue colour (due to the Lazurite). Too much pyrite causes a dull, greenish tint. In the best-quality specimens, the colour is evenly distributed, but in general it is spotty or striated.

As well as use in carvings and gems, it has been used for millennia as a blue pigment when ground to a fine powder (known as ultramarine).","https://www.gemdat.org/gphotos/0355585001351030735.jpg","Lapis lazuli","Afghanistan","Natural","None reported","Carved","444.55 cts.","52.99mm x 46.27mm x 35.93mm","N/A"
234,"Anhydrite","Anhydrite was named by A. G. Werner in 1804, from Greek ""an"" - without and ""hydor"" - water, because of the absence of water of crystallization, in contrast with the presence of water in gypsum. 

When exposed to water, anhydrite transforms to gypsum by the absorption of water. This transformation is reversible, gypsum forms anhydrite by heating to ~200°C under normal atmospheric conditions.

Fine specimens are very rare. Small crystals and pieces of clean facet-grade rough are found in salt mines. Anhydrite is very rarely faceted or cut as cabochons.","https://www.gemdat.org/gphotos/0295858001344634072.jpg","Anhydrite","Simplon Railway tunnel (north section), Termen, Brig, Valais, Switzerland","Natural","None reported","Emerald","3.89 cts.","12.8mm x 6.1mm x ?","Dee Parsons"
2356,"Lazulite","Lazulite was first described in 1795 for deposits in Styria, Austria. Its name comes from the German lazurstein - blue stone; or from the Arabic - heaven, because of its blue colour. 

Lazulite is sometimes confused with 2 better known and more common minerals: lazurite and azurite. Lazulite frequently appears as euhedral crystals rather than in massive form.","https://www.gemdat.org/gphotos/0460777001351549720.jpg","Lazulite","Pakistan","Natural","None reported","Pear","0.75 cts.","8.9mm x 5.0mm x ?","N/A"
2357,"Lazurite","Lazurite is named after Latin ""lazulum"" or Persian ""lazhward"" - blue, alluding to its colour.

Lazurite can be found as well-formed crystals of deep blue colour. But it is more frequent in its massive form as the main component of Lapis Lazuli.

Lazurite is cut into cabochons or can be used for carvings.

Mineralogically speaking Lazurite is a sulfide-rich variety of Hauyne.","https://www.gemdat.org/gphotos/0355585001351030735.jpg","Lapis lazuli","Afghanistan","Natural","None reported","Carved","444.55 cts.","52.99mm x 46.27mm x 35.93mm","N/A"
2365,"Legrandite","Legrandite is named after Mr. Legrand, Belgian mining engineer, collector of the first specimen from Flor de Pina mine, Nueva Leon, Mexico.

Legrandite forms in tight clusters and sometimes transparent bright yellow, orange, colourless elongated prismatic crystals. These crystals are large enough to be faceted.","https://www.gemdat.org/gphotos/0171896001345320021.jpg","Legrandite","Mexico","Natural","None reported","N/A","0.45 cts.","N/A","N/A"
2380,"Lepidolite","Lepidolite is named after Greek ""lepidos"" - scale, alluding to the scaly appearance of many specimens.

Lepidolite is a violet to pink variety of Mica. Massive fine-grained material is used for ornamental purposes, it is polished into various shapes - cabochons and slabs. Transparent to translucent material is sometimes faceted.","https://www.gemdat.org/gphotos/0885363001351086870.jpg","Lepidolite","Mexico","Natural","None reported","Fancy Cabochon","19.93 cts.","25.83mm x 21.03mm x 5.12mm","N/A"
2395,"Liddicoatite","Liddicoatite is a calcium lithium tourmaline species, named after US gemologist R. T. Liddicoat. 

Liddicoatite forms green, red, pink, purple, and and blue, sometimes white, colorless, black, brown, yellow, and orange elongated prismatic crystals. Crystals are frequently multicolored, containing two or more distinct colours. It may also have internal colour zoning and banding.

Large crystals of Liddicoatite are often cut and polished into slices, with the multicolored designs and forms. Faceted material is rare because of its limited occurrences, and because most gem material is not tested to determine what type of tourmaline mineral it is - so will be labelled as Tourmaline regardless of whether it is Liddicoatite, Elbiate or another type of Tourmaline.","https://www.gemdat.org/gphotos/0404745001342814981.jpg","Liddicoatite","Madagascar","Natural","None reported","Emerald","1.25 cts.","N/A","N/A"
2403,"Linarite","Linarite is named after its discovery locality at Linares, Jaén, Spain.

Linarite forms elongated and characteristically tabular transparent to translucent bright to dark blue crystals, which may appear deep blue in transmitted light.

Suitable for faceting material is rare.","https://www.gemdat.org/gphotos/0128965001425573997.jpg","Linarite","Tuscany, Italy","Natural","None reported","Cabochon","21.90 cts.","18mm x 16mm x 7mm","N/A"
2452,"Ludlamite","Ludlamite was named after Henry Ludlam, a British collector of rare minerals. It was first discovered in 1876 in Wheal Jane mine in Cornwall, England.

Ludlamite is a rare phosphate mineral. It forms apple- to bright green prismatic crystals. Ludlamite is occasionally faceted, but the crystals are always small.","https://www.gemdat.org/gphotos/0592134001357774918.jpg","Ludlamite","Blackbird Mine, Tenmile Mining District, Idaho Co., Idaho, USA","Natural","None reported","Square Cushion","0.52 cts.","4.4mm x ?","N/A"
246,"Anorthite","Anorthite is the calcium-rich endmember of the Plagioclase solid solution series, it is a rare compositional variety of Plagioclase.","https://www.gemdat.org/gphotos/0896879001296880710.jpg","Anorthite","Miyake Island, Miyake, Miyake Subprefecture, Tokyo Metropolis, Japan","Natural","None reported","N/A","0.52 cts.","N/A","Yuko Tanaka"
2465,"Leucite","Leucite is named after Greek ""leukos"" - white, alluding to its typical colour. 

Crystals are often twinned. Transparent facet rough is very rare. 

Leucite is a rare mineral, the volcanic lava of Mount Vesuvius in Italy is the principal source of this material.","https://www.gemdat.org/gphotos/0632510001345320399.jpg","Leucite","Italy","Natural","None reported","Round Brilliant","0.59 cts.","N/A","N/A"
2482,"Magnesite","Magnesite is named from Greek ""magnesia lithos"" - magnesian stone, a kind of ore from Magnesia, the coastal district of ancient Thessaly, Greece.

Magnesite frequently occurs as translucent, sometimes transparent colourless, white, yellowish to brown or grey masses with an earthy or chalky appearance. This material is cut into cabochons. 

Transparent crystals of gem-quality are very rare. The amount of faceted stones is mostly limited to specialized collections.","https://www.gemdat.org/gphotos/0500622001345455698.jpg","Magnesite","Brazil","Natural","None reported","N/A","8.80 cts.","N/A","N/A"
2538,"Magnetite","Natural magnets (lodestones) were known to ancient Greeks, who called this mineral ""magnet"", because it was found in the lands of the Magnetes (Magnesia) in Thessaly. 

Magnetite is a heavy material, black or brownish-black with a metallic luster. It is the most magnetic of all natural commonly occurring minerals on the Earth. 

The originally bright black colour can gradually change to dark brown.

Magnetite is often used in jewelry due to its supposed magnetic healing properties.","https://www.gemdat.org/gphotos/0804182001345455841.jpg","Magnetite","Iankaroka corundum occurrence, Ianabinda, Betroka, Anosy, Madagascar","Natural","None reported","N/A","5.13 cts.","N/A","N/A"
2550,"Malachite","Malachite is named after Greek word for ""mallow"" because of its resemblance to the leaves of the Mallow plant. It is a green, very common secondary copper mineral with a widely variable habit. Malachite shows a banding of light and dark layers with concentric rings, straight stripes and other figurative shapes caused by its shell-like formation. 

Malachite was popular in ancient Egypt, Greece and Rome and was used for jewelry, amulets, as a powder for eye shadow and colouring pigment. Nowadays it is popular for jewelry and ornaments.

Malachite dust is toxic and must not be inhaled during cutting and polishing.

Azurmalachite is an extremely colourful massive material that combines the rich hues of malachite and azurite.","https://www.gemdat.org/gphotos/0711070001351088932.jpg","Malachite","DR Congo","Natural","None reported","Rhomb Cabochon","14.71 cts.","14.05mm x 6.97mm","N/A"
260,"Antigorite","Antigorite is named after its discovery locality, in the Valle Antigorio, Piemonte, Italy. 

Antigorite is a hard compact type of Serpentine. It occurs in tough pleated masses. The material is usually dark green in colour, but may also be yellowish, gray, brown or black.","https://www.gemdat.org/gphotos/0506473001344634294.jpg","Antigorite","China","Natural","None reported","Cushion","6.76 cts.","15.8mm x 8.7mm x ?","John Bradshaw"
2638,"Mellite","Mellite is named from Greek ""meli"" - honey, alluding to its colour. It is sometimes called honeystone.

Mellite is an organic material, it forms transparent honey yellow or reddish prismatic or dipyramidal crystals or fine-grained masses.

Mellite can be polished and faceted into attractive gemstones.","https://www.gemdat.org/gphotos/0969958001345461434.jpg","Mellite","Hungary","Natural","None reported","Cushion","0.50 cts.","N/A","N/A"
2704,"Microcline","Microcline (Greek - small slope) has the same chemical composition as orthoclase but is classified in the triclinic crystal system.

The blue-green feldspar amazonite is the only gem variety of microcline.","https://www.gemdat.org/gphotos/0322595001350298269.jpg","Amazonite","Brazil","Natural","None reported","Round Cabochon","2.93 cts.","N/A","N/A"
2710,"Milarite","Milarite is named after its occurence in the Val Milar, Switzerland. The original specimens, however, came from Val Giuf, Tavetsch, Grischun, Switzerland.

Milarite is a rare beryllium silicate, that forms transparent to translucent colourless to pale yellow or green prismatic crystals, typically well formed.

A.Thomas (2009) reports: ""The small pieces of facet rough that have been cut to date have all originated from a single African source"".","https://www.gemdat.org/gphotos/0047776001360275780.jpg","Milarite","Switzerland","Natural","None reported","Baguette","0.20 cts.","6mm x 2mm x 2mm","N/A"
2714,"Mimetite","Mimetite is named from Greek ""mimetes"", an imitator, alluding to its resemblance to pyromorphite.

Mimetite forms transparent and very attractive prismatic crystals or botryoidal, globular masses of yellow to orange-yellow to brown colour, sometimes colourless with a characteristic resinous to subadamantine lustre.

Transparent, but slightly included material from Tsumeb has been faceted into gems over 1.00 ct (one specimen reported to show an orange-red fluorescence under LWUV).

Bright orange to pastel yellow and brown banded cabochons have been cut from globular masses of Mimetite from Mapimi, Durango, Mexico. Because of their high density and colour banding, these may be mistaken for the ""wood tin"" variety of cassiterite, or the ""schalenblende"" variety of sphalerite/wurtzite.","https://www.gemdat.org/gphotos/0755417001357819909.jpg","Mimetite","Chihuahua, Mexico","Natural","None reported","Cushion","0.53 cts.","4.5mm x 2.7mm x ?","N/A"
2750,"Monazite","Monazite is named after Greek ""monazein"" - to be solitary, alluding to its rare occurence as isolated crystals in the mineral's discovery material. The three minerals are monazite-(Ce), monazite-(La) and monazite-(Nd).

Monazite forms tabular or prismatic crystals of yellow, yellow-brown, brown, rose-red, reddish-brown colour. Colour change from reddish orange in daylight to pinkish brown in tungsten light has been reported.

Monazite usually contains small amounts of Th or sometimes U, both making it radioactive.","https://www.gemdat.org/gphotos/0025259001422773337.jpg","Monazite","Brazil","Natural","None reported","Round Brilliant","0.16 cts.","3.0mm x 3.0mm x ?mm","N/A"
2763,"Montebrasite","Montebrasite is named after its discovery locality, at Montebras, Creuse, France.

Montebrasite forms attractive, colourless, bright yellow-green, sometimes blue, pink and pale brown, equant to short-prismatic crystals, twinning is common.","https://www.gemdat.org/gphotos/0243845001345462460.jpg","Montebrasite","Brazil","Natural","None reported","Round Brilliant","2.56 cts.","N/A","N/A"
2774,"Moonstone","Moonstone is colourless, very translucent, or almost perfectly transparent feldspar, which in certain direction reflects a bluish, milky light, that has been compared to the light of the moon. 

Moonstone is a potassium feldspar of the orthoclase species with white shimmer, similar to moonshine (therefore the name), called adularescence. Thin alternating layers of orthoclase and albite create the light interference in this material that is responsible for its ""shiller"" or ""floating moon effect"".

Only specimens which show this sheen in a typical manner are cut as gems. To display the beauty of this stone to the best possible advantage , it is cut with a convex, polished surface of moderately strong curvature about the face which exhibits the sheen. The stone is very effective in cut and polished spheres, which may be strung together and worn as beads or for other ornamental purposes, when they have a certain resemblance to white pearls. Moonstone is always cut either en cabochon or with a plane surface, never with facets.","https://www.gemdat.org/gphotos/0825358001343737635.jpg","Moonstone","Myanmar","Natural","None reported","Cabochon","4.57 cts.","N/A","N/A"
2783,"Morganite","Morganite is named after the American banker and collector J.P Morgan. 

Morganite, also known as ""pink beryl"", ""rose beryl"", ""pink emerald"", and ""cesian (or caesian) beryl"", is a rare light pink to rose-coloured gem-quality variety of beryl. Orange/yellow varieties of morganite can also be found, and colour banding is common. 

The pink colour of Morganite is unstable and fades when heated to 500°C. The colour can be restored by radioactive bombardment.","https://www.gemdat.org/gphotos/0094255001353586401.jpg","Morganite","N/A","Natural","Irradiation","Freeform","115.66 cts.","32.4mm x 32.0mm x 10.5mm","N/A"
2791,"Moss Agate","Moss agate is a colourless, translucent Dendritic Agate variety of Chalcedony with inclusions of green hornblende (or chlorite) in moss-like patterns (therefore the name). 

Moss agate, although primarily green, can also show brown and red patterns due to the oxidation of the iron in the hornblende/chlorite. 

The name 'Agate' is generally accepted even though the stone is not banded as a true agate should be.","https://www.gemdat.org/gphotos/0694378001350936686.jpg","Moss Agate","Indonesia","Natural","None reported","Oval Cabochon","17.45 cts.","24.91mm x 17.92mm x 4.97mm","N/A"
28,"Adularia","Adularia is transparent colourless form of Orthoclase with white to blue sheen. It can be faceted, but cut stones are usually unimpressive.","https://www.gemdat.org/gphotos/0728723001376413347.jpg","Adularia","Pakistan","Natural","None reported","Cushion","0.87 cts.","N/A","N/A"
2815,"Muscovite","The name Muscovite derives from its use in windows as muscovy glass, Muscovy being an old Russian Province.

Muscovite is the most common member of the Mica Group. It typically occurs as massively crystalline material in ""books"" or in flaky grains.

Muscovite can be pink, colourless, silver-white, yellowish, greenish with a pearly luster on cleavage faces. It often has a sparkly look. 

Because of its silvery sheen, Muscovite is sometimes called cat's silver.","https://www.gemdat.org/gphotos/0729822001343674896.jpg","Muscovite","Brazil","Natural","None reported","N/A","1.94 cts.","N/A","N/A"
283,"Apophyllite","Apophyllite is named after Greek ""apo"" - away and ""phyllazein"" - to get leaves, alluding to its exfoliation when heated with a blowpipe. They can also be called ""fisheye stone"".

Apophyllite is popular because of its abundance, colour variety, and well-defined crystals, but easy cleavage, brittleness and extreme heat sensitivity make this material difficult to facet.","https://www.gemdat.org/gphotos/0770209001358972745.jpg","Apophyllite","India","Natural","None reported","Mixed","22.91 cts.","16.7mm x 16.2mm x 16.2mm","Brad Wilson"
2880,"Nepheline","Nepheline is named after Greek ""nephele"" - a cloud, alluding to the cloudy appearance that develops when the mineral is immersed in strong acid.

Nepheline forms transparent to nearly opaque prismatic crystals, usually colourless, but can be coloured gray, red, green, brown, yellow from various impurities. 

Transparent colourless material has been faceted.","https://www.gemdat.org/gphotos/0759792001471850402.jpg","Nepheline","Tawmaw (Tawhmaw; Taw Maw), Hpakant-Tawmaw Jade Tract, Hpakant Township (Hpakan; Phakant; Phakan), Mohnyin District, Kachin State, Myanmar","Natural","None reported","Round Cabochon","2.33 cts.","7.53mm x 7.95mm x ?mm","N/A"
2881,"Nephrite","Nephrite (Greek - kidney) is a dense, fibrous aggregate variety of the tremolite-actinolite series that is tougher than jadeite. It can be all colours, often with a yellow tint. The most valuable is green. But green colour of nephrite is often more subdued and darker than jadeite's green colour.

Nephrite is known as the toughest gem and carving material. 

Nephrite is a readily available, more affordable alternative to jadeite.","https://www.gemdat.org/gphotos/0376086001453430055.jpg","Nephrite","Onot river, Irkutsk Oblast, Russia","Natural","None reported","Oval Cabochon","8.00 cts.","12.00mm x 15.89mm x ?mm","N/A"
2883,"Neptunite","Neptunite is named after Neptune, Roman god of the sea, because it was found with aegirine, which was named after Aegir, the Scandinavian sea god.

Neptunite forms translucent or opaque black or very dark red prismatic crystals with square cross-sections. 

The crystals of Neptunite show piezoelectricity.","https://www.gemdat.org/gphotos/0796021001345475846.jpg","Neptunite","San Benito Co., California, USA","Natural","None reported","Emerald","11.78 cts.","N/A","N/A"
289,"Aquamarine","Aquamarine (from Latin: aqua marina, ""water of the sea"") is so named because of its seawater colour. 

It is a pale to medium blue, blue-green variety of beryl, probably the most common colour for gem quality beryl.

Crystals of gem quality can be very large. Unique Brazilian aquamarines such as the Marta Rocha with a weight of 37.7 kg produced 57.200 carats of cut stones, the Urubu with a weight of 33.2 kg, the Jacueto with a weight of 19 kg, and others, are widely known.

A deeper blue variety originally called Maxixe after the Maxixe mine in Brazil where it was found, is better referred to as Blue beryl (Maxixe).","https://www.gemdat.org/gphotos/0687656001353496344.jpg","Aquamarine","N/A","Natural","None reported","Freeform","15.90 cts.","22.9mm x 16.5mm x 5.3mm","N/A"
2902,"Nifontovite","Nifontovite is named after R. V. Nifontov, Russian geologist.

Nifontovite forms transparent to translucent colourless to gray tabular crystals up to 6 cm long. 

Nifontovite is a very rare gem found in just a few localities around the world. Crystals from Charcas, Mexico are transparent, colourless and relatively large.","https://www.gemdat.org/gphotos/0484559001345476158.jpg","Nifontovite","Charcas, Charcas Municipality, San Luis Potosí, Mexico","Natural","None reported","Freeform","1.71 cts.","N/A","N/A"
2947,"Natrolite","Natrolite was named by Martin Heinrich Klaproth in 1803. The name is derived from Greek ""natron"" - soda, in reference to the sodium content and ""lithos"" - stone.

Natrolite produce some fine crystal specimens. The mineral is also often found as compact fibrous aggregates. It is usually white or colorless, sometimes reddish, greenish or yellowish. The luster is vitreous, finely fibrous specimens have silky luster.

Colourless facet rough natrolite is seldom.","https://www.gemdat.org/gphotos/0754121001364594175.jpg","Natrolite","Chimney Rock Quarry (Bound Brook Quarry; Stavola Industries Quarry), Bridgewater Township, Somerset Co., New Jersey, USA","Natural","None reported","Oval","0.68 cts.","7.01mm x 5.24mm x ?mm","N/A"
2976,"Oligoclase","A feldspar comprising 70-90% Albite and 10-30% Anorthite.

The name oligoclase derived from the Greek ""oligos"" - little, and ""clasein"" - to break, because the mineral was thought to have a less perfect cleavage than albite. This name was given by August Breithaupt in 1826.","https://www.gemdat.org/gphotos/0066803001345477027.jpg","Oligoclase","Kenya","Natural","None reported","Oval","2.57 cts.","N/A","commercially cut"
2999,"Onyx","Layer stone with the combination of a black base and a white upper layer, also called true onyx or Arabic onyx. Onyx is also a name sometimes used for unicolored Chalcedony (e.g., black onyx). 

The name Onyx has its origin in the Greek language and means ""fingernail"", probably because of its weak transparency.","https://www.gemdat.org/gphotos/0214787001400368465.jpg","Onyx","Russia","Natural","None reported","Square Cabochon","3.81 cts.","10.22mm x 10.22mm x ?mm","N/A"
