"id","name","description","img","gemstone","location_of_origin","origin","treatments","cut_type","weight","dimensions","cut_by"
1001,"Chiastolite","Chiastolite is an opaque variety of Andalusite. When the crystal is cut through, its cross-section will usually show an off-white body colour and a blackish diagonal cross, caused by carbonaceous inclusions. These crystals are often sectioned, polished and used as amulets, sometimes chiastolite is cut into cabochons, tablets.

It is also known as Cross-stone.","https://www.gemdat.org/gphotos/0260195001453430122.jpg","Chiastolite","Möng Hsu (Monghsu; Maing Hsu), Loilen District, Shan State, Myanmar","Natural","None reported","Cabochon","6.22 cts.","10.15mm x 10.01mm x ?mm","N/A"
10019,"Blue Beryl (Maxixe)","Maxixe Beryl is a variety of beryl that has a bright or dark blue colour. The colour gradually fades in daylight to a brown-yellow colour, which diminishes its value as a gemstone. 

Originally (since 1917) it came only from the Maxixe Mine in Minas Gerais (Brazil). More recently beryl from multiple sources has been sold as 'Maxixe', which has lead to many in gemmological circles preferring to use the terms 'Blue Beryl' or 'Maxixe-type beryl'. 

Since the 1970s it has been more widely available and enhanced through irradiation, but the colour fades after prolonged exposure to light or heat although it is much slower with indoor lighting.","https://www.gemdat.org/gphotos/0058257001357819539.jpg","Blue Beryl (Maxixe)","N/A","Natural","Diffusion","N/A","12.44 cts.","15.7mm x 11.9mm x ?","N/A"
1003,"Childrenite","Childrenite is named after J.G. Children, English physician and naturalist.

Childrenite forms transparent to translucent, brown, yellow-brown, dark-yellow tabular or bladed crystals. Facet-quality rough is rare and cut stones are often relatively small.

Childrenite is closely related to eosphorite.","https://www.gemdat.org/gphotos/0663649001357128000.jpg","Childrenite","Brazil","Natural","None reported","N/A","2.62 cts.","7.8mm x ?","N/A"
1027,"Chondrodite","Chondrodite is named after Greek ""chondros"" - a grain, alluding to its frequent granular appearance. 

Transparent to translucent orange-brown specimens exhibiting orange-brown to yellow-brown pleochroism have been reported from Sri Lanka. Transparent deep garnet-red material of gem-quality is found in the Tilly Foster mine, Brewster, New York, USA.

Chondrodite is one of the rarest and most beautiful of gemstones and it is occasionally faceted for collectors.","https://www.gemdat.org/gphotos/0948310001357777025.jpg","Chondrodite","Tilly Foster Iron Mine, Brewster, Town of Southeast, Putnam Co., New York, USA","Natural","None reported","Round Brilliant","0.09 cts.","2.7mm x ?","N/A"
10272,"Garnet Group","Garnet is extensively used as a gem. The name is said to have been derived from the colour of the gem varieties, red garnets having been compared to the flowers and seeds of the pomegranate-tree.

The most common colour of Garnet is red, the most usual tones being tinged with brown, yellow and violet. Green garnet, the colour of which is similar to that of the emerald, though usually more yellowish or brownish, is also cut as a gem, but less frequently. Black garnets also occur and are used in mourning jewellery. Blue is a colour conspicuous by its complete absence in the garnet group. 

Amongst all varieties there are numerous specimens of perfect clearness and transparency, sometimes combined with the deepest and darkest shade of colour which are cut as gems.

Garnet is a name given to a group of closely related silicate minerals sharing the same isometric structure. In mineralogy the term garnet has been expanded to include other non-silicate minerals with the same structure, but in gemmological usage, garnet relates specifically to the various mineral species listed below.","https://www.gemdat.org/gphotos/0449973001350853617.jpg","Hessonite","Madagascar","Natural","None reported","Oval","22.77 cts.","19.28mm x 14.58mm x 9.56mm","N/A"
10295,"Copper-bearing Elbaite","A copper-bearing Elbaite.","https://www.gemdat.org/gphotos/0901952001343829472.jpg","Paraíba Tourmaline","Brazil","Natural","None reported","Oval","1.77 cts.","N/A","N/A"
1039,"Chrysoberyl","Chrysoberyl is named after Greek ""chrysos"" - gold, plus ""beryllos"" - beryl, a name used from antiquity for gold-coloured beryl.

Chrysoberyl forms transparent to translucent yellow, yellowish-green, golden yellow or brown multiple contact and penetration twinned or prominently striated short prismatic crystals with vitreous lustre.

Chrysoberyl is cut into fine gemstones of remarkable clarity and high lustre. Chatoyant chrysoberyl shows an eye when translucent and cut into cabochon.","https://www.gemdat.org/gphotos/0058134001357125563.jpg","Alexandrite","Sri Lanka","Natural","None reported","Cushion","3.55 cts.","9.07mm x 7.55mm x 5.85mm","N/A"
1040,"Chrysocolla","The name Chrysocolla derives from Greek chrysos - gold and kolla - glue, referring to its use as a flux in soldering gold. The term was used from antiquity.

Pure chrysocolla is a soft and fragile material. Much of the chrysocolla used in jewellery consists of very attractive cabochons of green or blue chrysocolla impregnating either rock crystal or opal. 

Chrysocolla is often found in a matrix of quartz, in which case the optical and physical properties may be closer to those of quartz. 

Chrysocolla covered by druses of small sparkling quartz crystals is called ""Drusy Chrysocolla"" and is very popular for jewelry. It is found in Peru.

The rarest and best quality is chrysocolla chalcedony with turquoise-like colour, but harder and chemically more stable than turquise. It comes from several copper mines in Arizona, Mexico, Taiwan and Peru.

See also: Eilat Stone, a blue-green gem material from Israel that contains Chrysocolla.","https://www.gemdat.org/gphotos/0789265001343916825.jpg","Chrysocolla","USA","Natural","None reported","Freeform","16.46 cts.","N/A","N/A"
10403,"Jade","In strict gemmological terms, jade relates to two minerals jadeite or nephrite found as tough fine-grained rocks ideal for carving. Differentiation between jadeite and nephrite is based on properties, but the term Jade is used as a description of both.
The name Jade is derived from Spanish word for ""stone of the loins"" - hip stone, as it was seen as a protection against and cure for kidney deseases.","https://www.gemdat.org/gphotos/0335283001345239504.jpg","Jadeite","Myanmar","Natural","None reported","Marquise","8.59 cts.","N/A","N/A"
1052,"Cinnabar","Cinnabar is named after Greek ""kinnabaris"", the ancient name for the mineral; possibly from Arabic ""zinjafr"" or Persian ""zinjifrah"", dragon's blood, probably alluding to its colour.

Cinnabar usually occurs as masses or crusts. Well-formed crystals are very rare. The material has cochineal-red colour with adamantine to metallic lustre. 

Clear cinnabar crystals are faceted into spectacular stones. Massive material is used for cabochons.","https://www.gemdat.org/gphotos/0983766001344944962.jpg","Cinnabar","China","Natural","None reported","Round Brilliant","8.54 cts.","N/A","Michael Gray"
1054,"Citrine","The name Citrine is derived from its lemon yellow colour. 

Citrine is sometimes very pale or almost colourless. Among deeper coloured stones may be seen wine-yellow, honey-yellow, and saffron-yellow specimens, while others have quite a pronounced brown tinge. Stones of a deep brownish-yellow colour are very similar to topaz, and those of a fine golden-yellow are quite equal in beauty to yellow topaz and can scarcely be distinguished on mere inspection from latter stone except by an expert. 

Natural citrines are rare. Most commercial citrine is heat-treated amethyst or smoky quartz. Because the color is now caused by finely distributed iron minerals (mostly hematite and goethite), heated amethyst is not a citrine in the strict sense.

Quartz colored by inclusions of any kind is not called a citrine.","https://www.gemdat.org/gphotos/0822524001353583074.jpg","Citrine","N/A","Natural","Heat Treatment","Round","18.24 cts.","15.9mm x 8.2mm","N/A"
10577,"Transvaal Jade","A compact green jade-like variety of grossular containing up to 25% of zoisite. Frequently referred to as 'hydrogrossular', the hydrous content may be due to the zoisite component rather than it being a true hydrogarnet.","https://www.gemdat.org/gphotos/0196972001343857947.jpg","Transvaal Jade","South Africa","Natural","None reported","Cabochon","8.39 cts.","N/A","N/A"
10648,"Chrome-Diopside","Chrome-Diopside is a chrome-bearing variety of Diopside with strong emerald green colour.","https://www.gemdat.org/gphotos/0367783001344943985.jpg","Chrome-Diopside","Russia","Natural","None reported","Oval","1.26 cts.","N/A","commercially cut"
1070,"Clinochlore","Clinochlore is named from Greek ""klinein"" - to incline, plus ""klan"" - to break, referring to its oblique basal cleavage.

Clinochlore forms green, yellowish, red, rose-red tabular or prismatic crystals. May also be massive, radiating, and globular masses of dense flakes.

Clinochlore yields attractive cabochons.","https://www.gemdat.org/gphotos/0678144001351546425.jpg","Seraphinite","Russia","Natural","None reported","Round Cabochon","4.81 cts.","11.89mm x 4.76mm","N/A"
1077,"Clinohumite","Clinohumite was first discovered in metamorphosed limestone ejected from Mt Vesuvius in 1876. The name reflects its monoclinic structure and a similarity to humite.

Transparent gem-quality bright yellow to deep orange clinohumite was found only recently (in the early 1980s, and later in 2000). in the Pamir Mountains of Tadzhikistan. This facet rough has been cut into attractive orange-yellow gems. 

A dark brown material has been found in the Taymyr region, Siberia.","https://www.gemdat.org/gphotos/0728191001344945854.jpg","Clinohumite","Tajikistan","Natural","None reported","Emerald","1.12 cts.","N/A","John Bradshaw"
10859,"Tektite","Tektite is a natural glass formed from a meteorite impact melting the local rock.

Many varietal names are given to Tektites from different localities. 

Moldavites are oval or spherical specimens of pale or bottle-green colour with few included bubbles and less obviously flattened from the Radomilice area of southern Bohemia, Czech Republic.

Bikolite is a name given to Tektites from the Bikol area of the Philippines.

Australites are button-shaped glass pieces found in South Australia and Tasmania. Billitonites are dark brown specimens found on Billiton Island between Sumatra and Borneo. 

Darwinites or Queenstownites are silica-rich and alumina-poor colourless to olive green to black specimens from Jukes-Darwin field near Queenstown, Tasmania.

Tektites can be distinguished from the much more abundant volcanic glasses (obsidian) by their negligible water content. A small splinter of tektite will fuse quietly in a flame to a droplet of glass, whereas a splinter of obsidian will froth up and expand in a flame owing to its small water content turning into steam.","https://www.gemdat.org/gphotos/0026909001351604213.jpg","Moldavite","Czech Republic","Natural","None reported","Oval","9.63 cts.","18.0mm x 13.5mm x ?","N/A"
10860,"Moldavite","Moldavite is named after the the former german name of the river Moldau, Czech Republic, where the material was first found in 1787. Czechs call them ""vltavin"", after the Czech name for the same river, the Vltava.

Moldavite is a natural glass, a variety of Tektite. Tektites are formed when terrestrial rock and soil is melted and ejected into space by meteorite impacts, and each impact produces a limited strewn field which is named. Consequently the name ""moldavite"" can only be used for tektites from one specific impact (in this case the Ries crater in Germany), the strewn field being mainly in the Czech Republic, together with minor neighboring areas of Germany and Austria. It is nonsense for other glasses to be marketed using variations of the name like ""African Moldavite"" (sic).

Moldavites are the most transparent of all the various types of tektites. They are found in many different color shades between brown and green, but normally only the ones with bottle-green hue are used for faceting. Occasionally faceted green bottle glass gets fraudulently passed off as ""moldavite"". True moldavite gems can be identified by their vermiform inclusions of lechatelierite (pure silica glass - melted quartz).","https://www.gemdat.org/gphotos/0026909001351604213.jpg","Moldavite","Czech Republic","Natural","None reported","Oval","9.63 cts.","18.0mm x 13.5mm x ?","N/A"
1087,"Clinozoisite","Clinozoisite was discovered in 1896 in Tyrol, Austria, and is named because of its monoclinic crystallography and resemblance to zoisite. 

Clinozoisite is colourless, yellow, greenish or pale rose-red mineral similar to Epidote, but containing little iron.","https://www.gemdat.org/gphotos/0824966001344950042.jpg","Clinozoisite","Skardu, Skardu Area, Gilgit-Baltistan, Pakistan","Natural","None reported","N/A","0.22 cts.","N/A","N/A"
10889,"Watermelon Tourmaline","A variety of Tourmaline with colour zoning showing a pink core and green edges.","https://www.gemdat.org/gphotos/0491347001343745531.jpg","Watermelon Tourmaline","Namibia","Natural","None reported","Freeform","33.15 cts.","N/A","N/A"
109,"Alexandrite","Alexandrite is a variety of Chrysoberyl. It was named after Czar Alexander II. 

It displays a color change (alexandrite effect) dependent upon the nature of ambient lighting. It is vivid grass green in daylight or fluorescent light, and intense raspberry red in artificial incandescent light. To accentuate this peculiar character the stone must be cut of a certain thickness, the difference in colour being much less marked in a stone cut with little depth. 

Until comparatively recent times alexandrite was found only in Russia, in the emerald mines on the right bank of the Takovaya, a small stream east of Ekaterinburg in the Urals. Today these mines produce very little and Sri Lanka becomes the major source for the material.","https://www.gemdat.org/gphotos/0711856001343685873.jpg","Alexandrite","India","Natural","None reported","Oval","2.00 cts.","N/A","N/A"
1094,"Cobalt-bearing Calcite","A pink to purple cobalt-bearing variety of Calcite.

Also known as Aphrodite Stone.

Cuttable material comes from Spain.","https://www.gemdat.org/gphotos/0022703001344950633.jpg","Cobalt-bearing Calcite","Spain","Natural","None reported","Round Brilliant","6.44 cts.","N/A","Unknown Cutter"
10984,"Sunstone (Aventurine feldspar)","Sunstone is a plagioclase feldspar that has red, more rarely green or blue glitter which is caused by light reflections from tiny hematite or goethite platelets.

The name derives from sunstones believed to have been used for navigation in the Middle Ages.

Sunstone is the official gemstone of Oregon, USA.","https://www.gemdat.org/gphotos/0010176001353943507.jpg","Sunstone","N/A","Natural","None reported","Freeform","5.66 cts.","13.3mm x 13.1mm x 4.0mm","N/A"
1108,"Colemanite","Colemanite is named after William Tell Coleman, mine owner and a founder of the California borax industry. 

Colemanite has variable crystal habits: short prismatic crystals, stubby and bead-like equant crystals, flattened crystals, that appear bladed with terminations.

Colemanite is highly sensitive to heat.","https://www.gemdat.org/gphotos/0427747001344951354.jpg","Colemanite","Billie Mine (Billie group; Ryan Mine; Billie I Mine; Billie II Mine), Ryan, Furnace Creek Mining District (Furnace Creek Borate Mining District), Inyo Co., California, USA","Natural","None reported","N/A","0.87 cts.","N/A","N/A"
1128,"Cordierite (Iolite)","Cordierite was discovered in 1813 and is named after the French geologist Louis Cordier. It is also called Iolite (Greek - violet), and is sometimes misleadingly termed ""Water sapphire"". 

Cordierite is famous for its remarkable trichroism: deep violet-blue (looking down the length of the prism) - blue-gray or yellowish-brown (when viewed through the sides). Oriented correctly Cordierite can be cut into attractive deep blue faceted gems. 

""Bloodshot Iolite"" originates from Sri Lanka. It has a distinct reddish sheen or aventurescence, caused by hematite and goethite inclusions.

Varieties with Cat's eye effect and weak asterism are known.","https://www.gemdat.org/gphotos/0121493001350934081.jpg","Cordierite","Madagascar","Natural","None reported","Heart","4.26 cts.","13.36mm x 10.31mm x 6.07mm","N/A"
1136,"Corundum","The name ""corundum"" is derived from the Tamil word ""kuruntam"" meaning ""ruby"". 

Corundum is called Ruby if red and Padparadscha if pink-orange. All other colours are called Sapphire.

High-quality ruby and sapphire have always been among the most expensive gems and are used in the most prestigious adornments.","https://www.gemdat.org/gphotos/0640799001343734098.jpg","Ruby","Mozambique","Natural","None reported","Cushion","3.59 cts.","N/A","N/A"
1144,"Covellite","Covellite is named after Niccolo Covelli, Italian mineralogist who discovered the mineral on Mount Vesuvius, Campania, Italy. 

Covellite forms opaque masses with vivid iridescent blue colours.

Massive material can be cut into brilliant blue cabochons.","https://www.gemdat.org/gphotos/0705115001425579103.jpg","Covellite","DR Congo","Natural","None reported","Cabochon","8.90 cts.","13mm x 10mm x 5mm","N/A"
1151,"Creedite","Creedite is named after its discovery locality, in Wagon Wheel Gap, Creede quadrangle, Mineral County, Colorado, USA.

Creedite is a rare mineral, it has unique crystal form and attractive range of colours. Transparent crystals are rarely large enough to facet. Some light purple transparent stones have been cut.","https://www.gemdat.org/gphotos/0842131001344951704.jpg","Creedite","China","Natural","None reported","N/A","0.36 cts.","N/A","N/A"
1157,"Crocoite","Crocoite was named crocoise in 1832, from the Greek ""krokos"" - saffron, in allusion to its colour. The name was first altered to crocoisite and afterwards to crocoite. It was discovered at Berezovsky deposit near Ekaterinburg in the Urals in 1766.

Crocoite is commonly found as well-developed crystals of a bright hyacinth-red, orange, or yellow colour, near transparent to translucent, and have an adamantine to vitreous lustre. 

The material is brittle, has good cleavage and very sensitive to heat. Transparent crystals of crocoite have been faceted into brilliant stones for collectors.","https://www.gemdat.org/gphotos/0123722001344952046.jpg","Crocoite","Tasmania, Australia","Natural","None reported","Freeform","4.20 cts.","N/A","N/A"
1172,"Cuprite","Cuprite was first described in 1845 and the name derives from the Latin ""cuprum"" for its copper content.

Cuprite forms well-developed cubic crystals. It shows internal reflections of the deep garnet-red colour inside the almost black crystal. Cuprite has metallic luster and very high refractive index. Cuprite produces attractive cabochons and fine faceted stones, but it is very soft and brittle.

There are different types of stone which are dyed red and offered in the trade as cuprite.","https://www.gemdat.org/gphotos/0720672001342783796.jpg","Cuprite","Namibia","Natural","None reported","Trillion","35.31 cts.","N/A","N/A"
1218,"Danburite","Danburite was first found in Danbury (therefore the name), Connecticut, USA. 

Danburite is little known as a gemstone, but its popularity is growing. Its crystals have excellent clarity and they are easy to cut into brilliant attractive gems. Cut stones of 3-6 carats or more (up to 100 carats).","https://www.gemdat.org/gphotos/0932443001353584892.jpg","Danburite","N/A","Natural","None reported","Freeform","24.33 cts.","23.0mm x 18.2mm x 7.2mm","N/A"
124,"Allanite","Allanite is named in 1810 after Thomas Allan, the Scottish mineralogist who first noticed it.

Allanite is a member of the Epidote group. It is opaque, with a dark brown (sometimes virtually black) colour. 

Allanite contains the rare earth elements Yttrium and Lanthanum.","https://www.gemdat.org/gphotos/0221978001351600395.jpg","Allanite","Brazil","Natural","None reported","N/A","3.47 cts.","11.9mm x 5.8mm x ?","N/A"
1258,"Demantoid","Demantoid is the green gemstone variety of andradite, a member of the garnet group of minerals. It is the most valuable garnet (name means ""diamond-like luster). 

The demantoid was discovered in 1868 in Russia's western central Ural Mountains.","https://www.gemdat.org/gphotos/0323026001343745113.jpg","Demantoid","Russia","Natural","None reported","Oval","2.09 cts.","N/A","N/A"
1282,"Diamond","A diamond (from the ancient Greek adámas, meaning ""unbreakable,"" ""proper,"" or ""unalterable"") is one of the best-known and most sought-after gemstones. Diamonds have been known to humankind and used as decorative items since ancient times; some of the earliest references can be traced to India.

The hardness of diamond and its high dispersion of light – giving the diamond its characteristic ""fire"" – make it useful for industrial applications and desirable as jewellery. 

Perhaps the most famous use of the diamond in jewellery is in engagement rings, which became popular in the early to mid 20th century due to an advertising campaign by the De Beers company, though diamond rings have been used to symbolize engagements since at least the 15th century.","https://www.gemdat.org/gphotos/0582412001356015889.jpg","Diamond","N/A","Natural","None reported","Pear","0.80 cts.","8.23mm x 5.43mm x 2.91mm","N/A"
1285,"Diaspore","Diaspore is named from Greek ""diaspheirein"" - to scatter, alluding to its usual descrepitation when strongly heated.

Diaspore forms greenish-brown, yellow, colourless, sometimes pinkish or white platy crystals with vitreous lustre. Some specimens may show a slight colour change from greenish in daylight to pinkish brown under tungsten light.

Mamaris area in Mugla Province, Turkey seems to be the source of all large gem-quality crystals that have been faceted to date.","https://www.gemdat.org/gphotos/0353547001350644608.jpg","Diaspore","Turkey","Natural","None reported","Oval","0.57 cts.","N/A","N/A"
1294,"Diopside","Diopside is named after Greek word for ""double appearance"" because of its crystal shape. It is one of the most common members of the Pyroxene Group.

Diopside has a number of gem-quality varieties, including intense green Chrome diopside and fine blue Violane. Black diopside exhbiiting asterism or the Star effect is known.

Usual weight of cut stones is 1 - 20 carats. Compact fine-grained varieties are used as jewelry-industrial stone.","https://www.gemdat.org/gphotos/0265511001350556017.jpg","Chrome-Diopside","Russia","Natural","None reported","Oval","0.89 cts.","N/A","N/A"
1295,"Dioptase","Dioptase is named after Greek word for ""view through"" referring to the mineral's two cleavage directions that are visible inside unbroken crystals. 

Dioptase is a popular collectors' mineral specimen and is smetimes cut into small emerald-like gems. The material is very soft to be worn as a ring-stone, but small specimens are sometimes mounted in pendants and brooches.","https://www.gemdat.org/gphotos/0643871001342794461.jpg","Dioptase","DR Congo","Natural","None reported","Trillion","3.44 cts.","N/A","Brett Kosnar"
1304,"Dolomite","Dolomite is named after Déodat Gratet de Dolomieu, who described its characteristics and occurences.

Dolomite forms white, gray to pink rhombohedral crystals, some of them exhibit curved growth, possibly a result of twinning. It can also be massive. Small amounts of iron in the structure cause a yellow to brown tint. A high manganese content gives the crystals a rosy pink colour.","https://www.gemdat.org/gphotos/0316375001357680195.jpg","Dolomite","Austria","Natural","None reported","Emerald","6.67 cts.","12mm x 9mm x 4mm","N/A"
1318,"Dravite","Dravite is named after a deposit near the river Drave, Carinthia/Austria. It is a magnesium tourmaline, usually dark yellow to brownish black colour.","https://www.gemdat.org/gphotos/0390743001426610679.jpg","Dravite","Sri Lanka","Natural","None reported","Round Cabochon","0.15 cts.","3mm x 3mm x 2mm","N/A"
1329,"Dumortierite","Dumortierite was named after French paleontologist E. Dumortier. It is widely used as ornamental stone in its massive form. The deep violet to blue colour stones can be cut into attractive cabochons.","https://www.gemdat.org/gphotos/0296965001351611953.jpg","Dumortierite","Madagascar","Natural","None reported","Pear","0.15 cts.","5.0mm x 2.6mm x ?","N/A"
1340,"Datolite","Datolite is named after Greek ""datysthai"" - to divide, alluding to the granular habit of some massive specimens.

Datolite can be yellow, brown, light green, colourless, pink, red and violet. It forms prismatic crystals and nodular masses. Transparent crystals are faceted into brilliant stones and opaque massive material is cut into cabochons. Facet grade rough rarely exceeds 2 g.","https://www.gemdat.org/gphotos/0333227001357816355.jpg","Datolite","Roncari Quarry (Tilcon Quarry), East Granby, Hartford Co., Connecticut, USA","Natural","None reported","Oval Brilliant","2.40 cts.","10.2mm x 6.7mm x ?","N/A"
1361,"Ekanite","Ekanite is named in 1961 after F.L.D. Ekanayake, discoverer of the mineral in 1953 in Sri Lanka. The material was dark, dull green, but when it was polished as cabochons it revealed a four-rayed star. The specimen was found to be metamict and radioactive. 

Ekanite occurs in poorly formed prismatic crystals of straw-yellow colour when pure, sometimes dark red or brown colour, which is caused by inclusions.

Radioactivity limits the use of Ekanite as a gemstone, all specimens should be stored with great care. Cut stones have weight up to 25 carats.","https://www.gemdat.org/gphotos/0911077001345154240.jpg","Ekanite","Sri Lanka","Natural","None reported","N/A","3.51 cts.","N/A","N/A"
